{
  "version": 1,
  "domain_key": "medicine",
  "schema_name": "medicine",
  "display_name": "Medicine & Health Research",
  "description": "Medical research, clinical trials, epidemiology, public health, and biomedical advances.",
  "display_order": 20,
  "is_active": true,
  "database": {
        "clone_from": "politics",
    "include_article_topic_clusters": true,
    "migration_ref": "187_medicine_domain_silo.sql"
  },
  "rss": {
    "seed_feed_category": "General",
    "feeds": [
      {
        "feed_url": "https://pubmed.ncbi.nlm.nih.gov/rss/create/saved_searches/?term=medicine%5BMeSH+Major+Topic%5D&limit=100"
      },
      {
        "feed_url": "https://www.nejm.org/action/showFeed?jc=nejm&type=etoc&feed=rss"
      },
      {
        "feed_url": "https://www.thelancet.com/rssfeed/lancet_current.xml"
      },
      {
        "feed_url": "https://jamanetwork.com/rss/site_3/67.xml"
      },
      {
        "feed_url": "https://www.bmj.com/content/current.rss"
      },
      {
        "feed_url": "https://www.nature.com/nm.rss"
      },
      {
        "feed_url": "https://www.who.int/rss-feeds/news-english.xml"
      },
      {
        "feed_url": "https://www.who.int/feeds/entity/csr/don/en/rss.xml"
      },
      {
        "feed_url": "https://pubmed.ncbi.nlm.nih.gov/rss/create/saved_searches/?term=hantavirus%5BTitle%2FAbstract%5D&limit=50"
      },
      {
        "feed_url": "https://pubmed.ncbi.nlm.nih.gov/rss/create/saved_searches/?term=%28outbreak%5BTitle%2FAbstract%5D+OR+epidemic%5BTitle%2FAbstract%5D%29+AND+%28WHO%5BCorporate%5D+OR+CDC%5BCorporate%5D%29&limit=50"
      },
      {
        "feed_url": "https://www.fda.gov/about-fda/contact-fda/stay-informed/rss-feeds/press-releases/rss.xml"
      },
      {
        "feed_url": "https://clinicaltrials.gov/ct2/results/rss.xml?rcv_d=14&lup_d=14&sel_rss=new14&count=10000"
      },
      {
        "feed_url": "https://connect.medrxiv.org/medrxiv_xml.php"
      },
      {
        "feed_url": "https://connect.biorxiv.org/biorxiv_xml.php?subject=pathology"
      },
      {
        "feed_url": "https://connect.biorxiv.org/biorxiv_xml.php?subject=immunology"
      },
      {
        "feed_url": "https://connect.biorxiv.org/biorxiv_xml.php?subject=microbiology"
      },
      {
        "feed_url": "https://connect.biorxiv.org/biorxiv_xml.php?subject=pharmacology_and_toxicology"
      },
      {
        "feed_url": "https://connect.biorxiv.org/biorxiv_xml.php?subject=genetics"
      },
      {
        "feed_url": "https://connect.biorxiv.org/biorxiv_xml.php?subject=genomics"
      },
      {
        "feed_url": "https://connect.biorxiv.org/biorxiv_xml.php?subject=cancer_biology"
      },
      {
        "feed_url": "https://connect.biorxiv.org/biorxiv_xml.php?subject=epidemiology"
      },
      {
        "feed_url": "https://connect.biorxiv.org/biorxiv_xml.php?subject=clinical_trials"
      },
      {
        "feed_url": "https://connect.biorxiv.org/biorxiv_xml.php?subject=physiology"
      }
    ]
  },
  "focus_areas": [
    "Clinical trials and drug development",
    "Epidemiology and disease surveillance",
    "Medical breakthroughs and treatments",
    "Public health policy and guidelines",
    "Biomedical research and discoveries",
    "Healthcare technology and digital health",
    "Vaccine development and immunology",
    "Genetics and precision medicine"
  ],
  "llm_prompt_guidance": "Focus on evidence-based medical research and clinical significance. Distinguish between\npreliminary studies, clinical trials, and approved treatments. Highlight sample sizes,\nstudy limitations, and peer review status. Avoid sensationalizing medical claims. Include\nrelevant regulatory approvals (FDA, EMA, etc.) and clinical trial phases where applicable.",
  "workload_assumptions": {
    "expected_active_feeds": 25,
    "rough_new_articles_per_day": 200,
    "llm_heavy_phases_enabled": true
  }
}
